{
  "schemaVersion": 1,
  "generatedAt": "2026-04-21T00:00:00.000Z",
  "sourceDigests": {
    "seeds": "sha256:5a0ff7b5fd336505d1ee9286ead888aaba9494d20acf7349f2f48a3522122465",
    "approvals": "sha256:212e72fda66037e2b815a7a8e57d3a17a1739156262f663a93c284d67d5fa5da"
  },
  "families": {
    "move": {
      "en": {
        "lemmas": [
          "go",
          "walk",
          "move",
          "return",
          "enter",
          "leave"
        ],
        "inflections": {
          "go": [
            "goes",
            "went",
            "gone",
            "going"
          ],
          "walk": [
            "walks",
            "walked",
            "walking"
          ],
          "move": [
            "moves",
            "moved",
            "moving"
          ],
          "return": [
            "returns",
            "returned",
            "returning"
          ],
          "enter": [
            "enters",
            "entered",
            "entering"
          ],
          "leave": [
            "leaves",
            "left",
            "leaving"
          ]
        }
      },
      "cn": {
        "tokens": [
          "去",
          "来到",
          "回到",
          "走到",
          "进入",
          "离开"
        ]
      }
    },
    "possession": {
      "en": {
        "lemmas": [
          "take",
          "pick up",
          "hold",
          "show",
          "hand",
          "put"
        ],
        "inflections": {
          "take": [
            "takes",
            "took",
            "taken",
            "taking"
          ],
          "pick up": [
            "picks up",
            "picked up",
            "picking up"
          ],
          "hold": [
            "holds",
            "held",
            "holding"
          ],
          "show": [
            "shows",
            "showed",
            "shown",
            "showing"
          ],
          "hand": [
            "hands",
            "handed",
            "handing"
          ],
          "put": [
            "puts",
            "putting"
          ]
        }
      },
      "cn": {
        "tokens": [
          "拿起",
          "拿出",
          "展示",
          "递给",
          "交给",
          "放下"
        ]
      }
    },
    "status_change": {
      "en": {
        "lemmas": [
          "open",
          "close",
          "lock",
          "unlock",
          "light",
          "extinguish"
        ],
        "inflections": {
          "open": [
            "opens",
            "opened",
            "opening"
          ],
          "close": [
            "closes",
            "closed",
            "closing"
          ],
          "lock": [
            "locks",
            "locked",
            "locking"
          ],
          "unlock": [
            "unlocks",
            "unlocked",
            "unlocking"
          ],
          "light": [
            "lights",
            "lit",
            "lighted",
            "lighting"
          ],
          "extinguish": [
            "extinguishes",
            "extinguished",
            "extinguishing"
          ]
        }
      },
      "cn": {
        "tokens": [
          "打开",
          "关上",
          "锁上",
          "解锁",
          "点亮",
          "熄灭"
        ]
      }
    }
  }
}
